{
  "meta": {
    "id": "tj-2026-nankai-yimo-25",
    "outputPath": "site/problems/tj/25/tj-2026-nankai-yimo-25.html",
    "pageTitle": "2026 年天津市南开区一模 第 25 题（二次函数综合）",
    "pageDescription": "2026 天津市南开区一模第 25 题：由 2a+b=0 确定对称轴与 D，再利用旋转等条件（∠MDN=90°，DM=DN）建立 N 坐标和抛物线参数，最终求 EG+FG 的最小值。",
    "breadcrumbTitle": "2026 天津市南开区一模 第 25 题"
  },
  "problem": {
    "summary": "第 25 题（2026 天津市南开区一模）二次函数综合：由 2a+b=0 推导 D 坐标，建立动点关系，求 EG+FG 的最小值。",
    "lines": [
      { "text": "（25）（本题共 12 分）已知抛物线 y＝ax²＋bx＋c（a＞0）与 y 轴交于点 C，且满足 2a＋b＝0，对称轴与 x 轴的交点为 D。" },
      { "text": "（Ⅰ）当 a＝2，c＝−5 时，求点 D 的坐标及抛物线的解析式；", "answerId": "answerI", "answer": "D(1,0)；y＝2x²－4x－5" },
      { "text": "（Ⅱ）设 M(m,1)（m＞2）在抛物线上，N 在抛物线上且在第四象限，∠MDN＝90°，DM＝DN。E 在线段 DM 上，G 在线段 MN 上，F 为 DN 的中点，且 DE＝√2·NG。" },
      { "text": "① 当 MN＝√10 时，直接写出抛物线的解析式及 EG＋FG 的最小值；", "answerId": "answerQ1", "answer": "y＝x²－2x－2；最小值＝5/2" },
      { "text": "② 当 EG＋FG 的最小值为 5√10/2 时，求抛物线解析式及此时 G 的坐标。", "answerId": "answerQ2", "answer": "y＝(1/6)x²－(1/3)x－7；G(4, −13/3)" }
    ]
  },
  "ui": {
    "legend": [
      { "colorVar": "paper", "label": "第（Ⅰ）问抛物线  y＝2x²－4x－5" },
      { "colorVar": "fold",  "label": "第（Ⅱ）问动态抛物线（随 m 变化）" }
    ],
    "sliderLabel": "参数 m",
    "paramLabelPrefix": "m=",
    "goToProblemMode": "doubleScroll",
    "groupTitles": {
      "第（Ⅰ）问": "第（Ⅰ）问  求 D 与解析式",
      "第（Ⅱ）①问": "第（Ⅱ）①  MN＝√10 情形",
      "第（Ⅱ）②问": "第（Ⅱ）②  最小值已知情形"
    }
  },
  "steps": [
    {
      "id": "i1s1",
      "section": "第（Ⅰ）问",
      "title": "第1步：由 2a+b=0 求 D 坐标",
      "t": 3.5,
      "derive": [
        ["∵", "a＝2，c＝−5，且 2a＋b＝0"],
        ["∴", "b＝−2a＝−4"],
        ["∴", "对称轴 x＝−b/(2a)＝4/4＝1"],
        ["∴", "D 在对称轴与 x 轴的交点，故 D(1, 0)"]
      ],
      "box": ["b＝−4", "对称轴 x＝1", "D(1, 0)"]
    },
    {
      "id": "i1s2",
      "section": "第（Ⅰ）问",
      "title": "第2步：写出解析式",
      "t": 3.5,
      "derive": [
        ["∵", "a＝2，b＝−4，c＝−5"],
        ["∴", "y＝2x²－4x－5"]
      ],
      "box": ["y＝2x²－4x－5"]
    },
    {
      "id": "q1s1",
      "section": "第（Ⅱ）①问",
      "title": "第1步：用全等三角形确定 N 的坐标",
      "t": 3,
      "derive": [
        ["∵", "对称轴恒为 x＝1"],
        ["∴", "D(1,0)"],
        ["作", "MU⊥x轴于 U，NV⊥x轴于 V"],
        ["∵", "M(m,1)"],
        ["∴", "U(m,0)，DU＝m−1，MU＝1"],
        ["∵", "∠MDN＝90°，DM＝DN"],
        ["∴", "Rt△DUM≌Rt△VND"],
        ["∴", "DV＝MU＝1，NV＝DU＝m−1"],
        ["∵", "N 在第四象限"],
        ["∴", "V(2,0)，N(2,1−m)"]
      ],
      "box": ["D(1,0)", "N＝(2,1−m)"]
    },
    {
      "id": "q1s2",
      "section": "第（Ⅱ）①问",
      "title": "第2步：求 m、M、N 与抛物线解析式",
      "t": 3,
      "derive": [
        ["∵", "△DMN 是等腰直角三角形"],
        ["∴", "MN＝√2·DM"],
        ["∵", "MN＝√10"],
        ["∴", "DM＝√5"],
        ["∴", "DM²＝(m−1)²＋1＝5"],
        ["∵", "m＞2"],
        ["∴", "m＝3"],
        ["∴", "M(3,1)，N(2,−2)"],
        ["∵", "N(2,−2) 在抛物线上"],
        ["∴", "4a＋2b＋c＝−2"],
        ["∵", "2a＋b＝0"],
        ["∴", "b＝−2a，c＝−2"],
        ["∵", "M(3,1) 在抛物线上"],
        ["∴", "9a＋3b−2＝1"],
        ["∴", "a＝1，b＝−2"],
        ["∴", "y＝x²−2x−2"]
      ],
      "box": ["m＝3", "M(3,1)，N(2,−2)", "y＝x²−2x−2"]
    },
    {
      "id": "q1s3",
      "section": "第（Ⅱ）①问",
      "title": "第3步：把两动点问题转化为单动点问题（EG+FG→DG+FG）",
      "t": 3,
      "derive": [
        ["作", "GH⊥DN 于 H，GK⊥DM 于 K"],
        ["∵", "△DMN 是等腰直角三角形，G 在 MN 上"],
        ["∴", "△GNH 是等腰直角三角形"],
        ["∴", "GH＝NH＝NG/√2"],
        ["∵", "四边形 DKGH 是矩形"],
        ["∴", "DK＝GH，GK＝DH"],
        ["∵", "DE＝√2·NG＝2GH"],
        ["∴", "EK＝DE−DK＝GH＝DK"],
        ["∵", "GK⊥DM，D、E、K 在 DM 上"],
        ["∴", "GK 垂直平分 DE"],
        ["∴", "△DGE 为等腰三角形，EG＝DG"],
        ["∴", "EG＋FG＝DG＋FG"]
      ],
      "box": ["EG＝DG", "EG＋FG＝DG＋FG"]
    },
    {
      "id": "q1s4",
      "section": "第（Ⅱ）①问",
      "title": "第4步：用将军饮马求最小值并合并答案",
      "t": 3,
      "derive": [
        ["作", "以 DM、DN 为邻边的正方形 DMD′N"],
        ["∵", "MN 是正方形的对角线"],
        ["∴", "D 与 D′ 关于 MN 对称"],
        ["∵", "G 在 MN 上"],
        ["∴", "DG＝D′G"],
        ["∴", "EG＋FG＝DG＋FG＝D′G＋FG≥D′F"],
        ["∵", "DM＝DN＝√5，F 是 DN 中点"],
        ["∴", "D′N＝√5，NF＝√5/2，且 D′N⊥DN"],
        ["∴", "D′F＝√[(√5)²＋(√5/2)²]＝5/2"],
        ["∴", "EG＋FG 的最小值为 5/2"],
        ["∴", "y＝x²−2x−2；最小值＝5/2"]
      ],
      "box": ["y＝x²−2x−2", "最小 EG＋FG＝5/2"]
    },
    {
      "id": "q2s1",
      "section": "第（Ⅱ）②问",
      "title": "第1步：由最小值 5√10/2 求 m 及解析式",
      "t": 8,
      "derive": [
        ["∵", "构造正方形 DMD′N 后，最小 EG＋FG＝D′F"],
        ["∵", "F 是 DN 中点"],
        ["∴", "D′F＝(√5/2)·DM"],
        ["∵", "DM＝√[(m−1)²＋1]＝√(m²−2m＋2)"],
        ["∴", "最小 EG＋FG＝(√5/2)·√(m²−2m＋2)"],
        ["∵", "最小值为 5√10/2"],
        ["∴", "√(m²−2m＋2)＝√10"],
        ["∴", "m²−2m＋2＝10 → m²−2m−48＝0"],
        ["∴", "(m−8)(m+6)＝0"],
        ["∵", "m＞2"],
        ["∴", "m＝8"],
        ["∴", "a＝1/6，b＝−1/3，c＝−7"],
        ["∴", "y＝(1/6)x²－(1/3)x－7"]
      ],
      "box": ["m＝8", "a＝1/6，b＝−1/3，c＝−7", "y＝(1/6)x²－(1/3)x－7"]
    },
    {
      "id": "q2s2",
      "section": "第（Ⅱ）②问",
      "title": "第2步：求 G 的坐标",
      "t": 8,
      "derive": [
        ["∵", "m＝8"],
        ["∴", "M(8,1)，N(2,−7)，F(3/2,−7/2)"],
        ["∵", "最短时 D′、G、F 三点共线"],
        ["∴", "G＝N＋(1/3)(M−N)"],
        ["∴", "G＝(2＋6/3, −7＋8/3)"],
        ["∴", "G＝(4, −13/3)"],
        ["∴", "解析式为 y＝(1/6)x²−(1/3)x−7，G(4,−13/3)"]
      ],
      "box": ["G(4, −13/3)"]
    }
  ],
  "policies": {
    "i1s1": { "movable": false, "range": [3.5, 3.5] },
    "i1s2": { "movable": false, "range": [3.5, 3.5] },
    "q1s1": { "movable": false, "range": [3, 3] },
    "q1s2": { "movable": false, "range": [3, 3] },
    "q1s3": { "movable": false, "range": [3, 3] },
    "q1s4": { "movable": false, "range": [3, 3] },
    "q2s1": { "movable": false, "range": [8, 8] },
    "q2s2": { "movable": false, "range": [8, 8] }
  },
  "stepLabels": {
    "i1s1": "1 求D坐标",
    "i1s2": "2 写解析式",
    "q1s1": "1 求N坐标",
    "q1s2": "2 求解析式",
    "q1s3": "3 转化线段和",
    "q1s4": "4 求最小值",
    "q2s1": "1 求解析式",
    "q2s2": "2 求G坐标"
  }
}
