{
  "meta": {
    "id": "bj-2026-haidian-yimo-26",
    "outputPath": "site/problems/bj/26/bj-2026-haidian-yimo-26.html",
    "pageTitle": "2026 年北京市海淀区一模 第 26 题（代数综合）",
    "pageDescription": "2026 北京市海淀区一模第 26 题：抛物线过 O、(2，0) 求系数关系；竖直线与抛物线、定直线 y＝－ax＋2a 的铅直距离 m，求 m＝0 的 t 及恒有 m＜9 时 a 的范围。",
    "breadcrumbTitle": "2026 北京海淀区一模 第 26 题"
  },
  "problem": {
    "summary": "第 26 题（2026 北京市海淀区一模）代数综合：铅直距离 m＝a|t²－t－2| 与参数范围。",
    "lines": [
      { "text": "（26）在平面直角坐标系 xOy 中，抛物线 y＝ax²＋bx＋c（a＞0）经过原点 O 与点（2，0）。过点（t，0）作 x 轴的垂线，分别交抛物线、直线 y＝－ax＋2a 于点 M、N，两点距离为 m（重合时 m＝0）。" },
      { "text": "（1）求 c 的值，并用含 a 的式子表示 b；", "answerId": "answerI", "answer": "c＝0；b＝－2a" },
      { "text": "（2）① 若 m＝0，求 t 的值；", "answerId": "answerII1", "answer": "t＝－1 或 t＝2" },
      { "text": "（2）② 若当－2＜t＜2 时，总有 m＜9，求 a 的取值范围。", "answerId": "answerII2", "answer": "0＜a≤9/4" }
    ]
  },
  "ui": {
    "legend": [
      { "colorVar": "paper", "label": "抛物线 y＝ax²－2ax（图示 a＝1.5）" },
      { "colorVar": "fold", "label": "直线 y＝－ax＋2a 与铅直距离 m" }
    ],
    "sliderLabel": "参数 t（竖直线 x＝t）",
    "paramLabelPrefix": "t=",
    "goToProblemMode": "doubleScroll",
    "groupTitles": {
      "第（1）问": "第（1）问  求 c 与 b",
      "第（2）①问": "第（2）①  m＝0",
      "第（2）②问": "第（2）②  恒有 m＜9"
    }
  },
  "steps": [
    {
      "id": "i1s1",
      "section": "第（1）问",
      "title": "第1步：由过原点求 c",
      "t": 0.5,
      "derive": [
        ["∵", "抛物线 y＝ax²＋bx＋c 过 O(0，0)"],
        ["∴", "0＝c"],
        ["∴", "c＝0"]
      ],
      "box": ["c＝0"]
    },
    {
      "id": "i1s2",
      "section": "第（1）问",
      "title": "第2步：由过 (2，0) 求 b",
      "t": 0.5,
      "derive": [
        ["∵", "c＝0 且抛物线过 (2，0)"],
        ["∴", "0＝4a＋2b"],
        ["∴", "b＝－2a"],
        ["∴", "y＝ax²－2ax"]
      ],
      "box": ["b＝－2a", "y＝ax²－2ax"]
    },
    {
      "id": "q2s1",
      "section": "第（2）①问",
      "title": "第1步：用 t 表示 M、N 与 m",
      "t": 0.5,
      "derive": [
        ["∵", "M 是 x＝t 与抛物线的交点"],
        ["∴", "M(t，at²－2at)"],
        ["∵", "N 是 x＝t 与直线 y＝－ax＋2a 的交点"],
        ["∴", "N(t，－at＋2a)"],
        ["∴", "m＝|(at²－2at)－(－at＋2a)|"],
        ["∴", "m＝a|t²－t－2|（a＞0）"]
      ],
      "box": ["M(t，at²－2at)", "N(t，－at＋2a)", "m＝a|t²－t－2|"]
    },
    {
      "id": "q2s2",
      "section": "第（2）①问",
      "title": "第2步：m＝0 求 t",
      "t": -1,
      "derive": [
        ["∵", "m＝0"],
        ["∴", "a(t²－t－2)＝0"],
        ["∵", "a＞0"],
        ["∴", "t²－t－2＝0"],
        ["∴", "(t＋1)(t－2)＝0"],
        ["∴", "t＝－1 或 t＝2"]
      ],
      "box": ["t＝－1 或 t＝2"]
    },
    {
      "id": "q2s3",
      "section": "第（2）②问",
      "title": "第1步：把 m＜9 写成 a 与 |t²－t－2|",
      "t": 0.5,
      "derive": [
        ["∵", "当－2＜t＜2 时总有 m＜9"],
        ["∴", "a|t²－t－2|＜9 对任意 t∈(－2，2) 成立"],
        ["∵", "t→－2⁺ 时 t²－t－2→4"],
        ["∴", "|t²－t－2| 可无限接近 4"],
        ["∴", "须有 4a≤9"],
        ["∵", "a＞0"],
        ["∴", "0＜a≤9/4"]
      ],
      "box": ["恒成立 ⇒ a·sup|t²－t－2| 不超过 9", "0＜a≤9/4"]
    },
    {
      "id": "q2s4",
      "section": "第（2）②问",
      "title": "第2步：比较区间内“中部”最大值",
      "t": 0.5,
      "derive": [
        ["∵", "在(－1，2) 上 t²－t－2≤0"],
        ["∴", "|t²－t－2| 在 t＝1/2 处取最大 9/4"],
        ["∵", "9/4＜4"],
        ["∴", "紧约束来自 t 靠近－2 而非 t＝1/2"],
        ["∴", "0＜a≤9/4"]
      ],
      "box": ["sup(－2，2) |t²－t－2|＝4（开区间上不取到）", "0＜a≤9/4"]
    }
  ],
  "policies": {
    "i1s1": { "movable": false, "range": [0.5, 0.5] },
    "i1s2": { "movable": false, "range": [0.5, 0.5] },
    "q2s1": { "movable": true, "range": [-1.85, 1.85] },
    "q2s2": { "movable": false, "range": [-1, -1] },
    "q2s3": { "movable": false, "range": [0.5, 0.5] },
    "q2s4": { "movable": false, "range": [0.5, 0.5] }
  },
  "stepLabels": {
    "i1s1": "1 求c",
    "i1s2": "2 求b",
    "q2s1": "1 写m",
    "q2s2": "2 m＝0",
    "q2s3": "1 不等式",
    "q2s4": "2 比较"
  }
}
