{
  "meta": {
    "id": "tj-2026-dongli-yimo-24",
    "outputPath": "site/problems/tj/24/tj-2026-dongli-yimo-24.html",
    "pageTitle": "2026 年天津市东丽区一模 第 24 题（平行四边形与平移直角三角形）",
    "pageDescription": "2026 天津市东丽区一模第 24 题：平行四边形 ABCD、等腰直角三角形 OEF 水平平移、线段 O′N 与重叠面积 S 的范围。",
    "breadcrumbTitle": "2026 天津市东丽区一模 第 24 题"
  },
  "problem": {
    "summary": "第 24 题（2026 天津市东丽区一模）平行四边形与平移等腰直角三角形",
    "lines": [
      { "text": "（24）在平面直角坐标系中，O 为原点，□ABCD 的顶点 A（3/2，1），C（0，3/2），∠ABC＝45°，点 D 在 y 轴负半轴上，点 B 在第一象限，边 AD 交 x 轴于点 M. △OEF 是等腰直角三角形，∠OEF＝90°，点 E（-2，0），点 F 在第二象限." },
      { "text": "（1）填空：如图①，点 F 的坐标为__________，点 B 的坐标为__________；", "answerId": "answer1", "answer": "答案：F（-2，2），B（3/2，3）" },
      { "text": "（2）将 △OEF 沿水平方向向右平移，得到 △O′E′F′，点 O，E，F 的对应点分别为 O′，E′，F′. 设 OO′＝t." },
      { "text": "①如图②，若边 O′F′ 与边 CD 交于点 G，与边 AD 交于点 N，△O′E′F′ 与 □ABCD 重合部分为四边形 OMNG 时，试用含 t 的式子表示线段 O′N 的长，并直接写出 t 的取值范围；", "answerId": "answer2a", "answer": "答案：O′N＝(√2/2)t－√2/4，1/2＜t≤3/2" },
      { "text": "②设平移后重叠部分的面积为 S，当 5/4≤t≤9/4 时，求 S 的取值范围（请直接写出结果即可）.", "answerId": "answer2b", "answer": "答案：41/64≤S≤11/8" },
      { "heading": "原题图形" },
      { "ariaLabel": "原题图 1 和图 2", "figures": [
        { "id": "originalFigure1", "title": "图 1", "ariaLabel": "图 1：平行四边形 ABCD 与原始等腰直角三角形 OEF" },
        { "id": "originalFigure2", "title": "图 2", "ariaLabel": "图 2：平移后三角形与平行四边形重叠为四边形 OMNG" }
      ] }
    ]
  },
  "ui": {
    "legend": [
      { "colorVar": "paper", "label": "固定平行四边形 ABCD" },
      { "colorVar": "fold", "label": "平移三角形 O′E′F′" },
      { "colorVar": "overlap", "label": "当前重叠区域 S" }
    ],
    "sliderLabel": "平移距离 · t＝OO′",
    "paramLabelPrefix": "t=",
    "goToProblemMode": "doubleScroll",
    "groupTitles": {
      "第（1）问": "第（1）问 坐标",
      "第（2）①问": "第（2）① O′N 与 t 范围",
      "第（2）②问": "第（2）② S 范围"
    }
  },
  "steps": [
    {
      "id": "q1s1",
      "section": "第（1）问",
      "title": "第1步：由等腰直角三角形求 F 坐标",
      "t": 0,
      "derive": [
        ["∵", "E（-2，0），O（0，0）"],
        ["∴", "OE＝2，且 OE 在 x 轴上"],
        ["∵", "△OEF 是等腰直角三角形，∠OEF＝90°"],
        ["∴", "EF⊥OE，EF＝OE＝2"],
        ["∵", "点 F 在第二象限"],
        ["∴", "F（-2，2）"]
      ],
      "box": ["F（-2，2）"]
    },
    {
      "id": "q1s2",
      "section": "第（1）问",
      "title": "第2步：由平行四边形性质确定 AB 与 H",
      "t": 0,
      "derive": [
        ["∵", "四边形 ABCD 是平行四边形"],
        ["∴", "AB∥CD"],
        ["∵", "C、D 都在 y 轴上"],
        ["∴", "CD 竖直，AB 也竖直"],
        ["∵", "A（3/2，1），过点 C 作 CH⊥AB 于 H"],
        ["∴", "H 在直线 AB 上，且 H（3/2，3/2）"],
        ["∴", "CH＝3/2"]
      ],
      "box": ["H（3/2，3/2）", "CH＝3/2"]
    },
    {
      "id": "q1s3",
      "section": "第（1）问",
      "title": "第3步：由等腰直角三角形 BCH 求 B 坐标",
      "t": 0,
      "derive": [
        ["∵", "H 在 AB 上，∠ABC＝45°"],
        ["∴", "∠CBH＝45°"],
        ["∵", "CH⊥AB"],
        ["∴", "∠BHC＝90°"],
        ["∴", "△BCH 是等腰直角三角形"],
        ["∴", "BH＝CH＝3/2"],
        ["∵", "点 B 在第一象限，且 B 在 H 上方"],
        ["∴", "yB＝3/2＋3/2＝3"],
        ["∴", "B（3/2，3）"]
      ],
      "box": ["B（3/2，3）"]
    },
    {
      "id": "q2a1",
      "section": "第（2）①问",
      "title": "第1步：由边长与 45° 角求 OM",
      "t": 1,
      "derive": [
        ["∵", "A（3/2，1），B（3/2，3）"],
        ["∴", "AB＝2"],
        ["∵", "□ABCD 是平行四边形"],
        ["∴", "CD＝AB＝2"],
        ["∵", "C（0，3/2），D 在 y 轴负半轴上"],
        ["∴", "D（0，-1/2）"],
        ["∴", "OD＝1/2"],
        ["∵", "AB∥CD"],
        ["∴", "∠ADC＝∠ABC＝45°"],
        ["∵", "M 在 AD 上，O、D、C 共线"],
        ["∴", "∠OMD＝45°"],
        ["∴", "△ODM 是等腰直角三角形"],
        ["∴", "OM＝OD＝1/2"]
      ],
      "box": ["D（0，-1/2）", "OM＝1/2"]
    },
    {
      "id": "q2a2",
      "section": "第（2）①问",
      "title": "第2步：由水平平移求 O′M",
      "t": 1,
      "derive": [
        ["∵", "OO′＝t，OM＝1/2"],
        ["∴", "O′M＝OO′－OM＝t－1/2"],
        ["∵", "△OEF 是等腰直角三角形，平移得到 △O′E′F′"],
        ["∴", "∠E′O′F′＝45°"]
      ],
      "box": ["O′M＝t－1/2", "∠E′O′F′＝45°"]
    },
    {
      "id": "q2a3",
      "section": "第（2）①问",
      "title": "第3步：由角度判断 △MO′N 为等腰直角三角形",
      "t": 1,
      "derive": [
        ["∵", "M、N 在 AD 上，O、M、O′ 在 x 轴上"],
        ["∴", "∠NMO′＝∠OMD＝45°"],
        ["∵", "N 在 O′F′ 上，M 在 O′E′ 所在直线上"],
        ["∴", "∠MO′N＝∠E′O′F′＝45°"],
        ["∴", "△MO′N 是等腰直角三角形"]
      ],
      "box": ["△MO′N 是等腰直角三角形", "MN＝NO′"]
    },
    {
      "id": "q2a4",
      "section": "第（2）①问",
      "title": "第4步：由等腰直角三角形 MO′N 求 O′N",
      "t": 1,
      "derive": [
        ["∵", "△MO′N 是等腰直角三角形，O′M 是斜边"],
        ["∴", "O′N＝O′M·sin45°"],
        ["∵", "O′M＝t－1/2"],
        ["∴", "O′N＝(√2/2)(t－1/2)"],
        ["∴", "O′N＝(√2/2)t－√2/4"]
      ],
      "box": ["O′M＝t－1/2", "O′N＝(√2/2)t－√2/4"]
    },
    {
      "id": "q2a5",
      "section": "第（2）①问",
      "title": "第5步：由边界位置求 t 范围",
      "t": 1,
      "derive": [
        ["∵", "左边界：t＝1/2 时，O′ 与 M 重合，N 与 M 重合"],
        ["∴", "此时四边形 OMNG 退化"],
        ["∴", "t＞1/2"],
        ["∵", "右边界：G 在 CD 上，最高可到 C（0，3/2）"],
        ["∵", "当 t＞3/2 时，G 越过 C，重叠部分不再是四边形 OMNG"],
        ["∴", "t≤3/2"],
        ["∴", "O′N＝(√2/2)t－√2/4，1/2＜t≤3/2"]
      ],
      "box": ["O′N＝(√2/2)t－√2/4", "1/2＜t≤3/2"],
      "minis": [
        { "title": "t＝1/2", "caption": "N 与 M 重合，四边形退化。", "t": 0.5 },
        { "title": "1/2＜t≤3/2", "caption": "重叠部分为四边形 OMNG。", "t": 1 },
        { "title": "t＝3/2", "caption": "G 到达 C，仍是四边形边界状态。", "t": 1.5 },
        { "title": "t＞3/2", "caption": "G 越过 C，重叠部分不再是四边形 OMNG。", "t": 1.75 }
      ]
    },
    {
      "id": "q2b1",
      "section": "第（2）②问",
      "title": "第1步：由边界状态判断重叠区域分段",
      "t": 1.8,
      "derive": [
        ["∵", "5/4≤t≤3/2 时，重叠部分为四边形 OMNG"],
        ["∴", "这一段面积随 t 增大而增大"],
        ["∵", "3/2＜t≤2 时，重叠部分变为五边形"],
        ["∴", "这一段面积继续随 t 增大而增大"],
        ["∵", "2＜t≤9/4 时，E′ 离开 O 后，左下角被截去"],
        ["∴", "这一段面积随 t 增大而减小"],
        ["∴", "最大值应在 t＝2 时取得"],
        ["∴", "最小值只需比较 t＝5/4 与 t＝9/4"]
      ],
      "box": ["最大值看 t＝2", "最小值比较 t＝5/4 与 t＝9/4"],
      "minis": [
        { "title": "5/4≤t≤3/2", "caption": "重叠区域为四边形 OMNG。", "t": 1.25 },
        { "title": "3/2＜t≤2", "caption": "上边界进入，重叠区域为五边形 OMNQC。", "t": 1.8 },
        { "title": "2＜t≤9/4", "caption": "E′ 离开 O，左下角被截去。", "t": 2.2 }
      ]
    },
    {
      "id": "q2b2",
      "section": "第（2）②问",
      "title": "第2步：代入 t＝5/4 求左端面积",
      "t": 1.25,
      "derive": [
        ["∵", "最小值候选之一是 t＝5/4"],
        ["∴", "OG＝OO′＝5/4"],
        ["∴", "S△OGO′＝1/2×5/4×5/4＝25/32"],
        ["∵", "O′M＝5/4－1/2＝3/4，△MNO′ 是等腰直角三角形"],
        ["∴", "S△MNO′＝(3/4)²÷4＝9/64"],
        ["∵", "S＝S△OGO′－S△MNO′"],
        ["∴", "S(5/4)＝25/32－9/64＝41/64"]
      ],
      "box": ["S(5/4)＝41/64"]
    },
    {
      "id": "q2b3",
      "section": "第（2）②问",
      "title": "第3步：代入 t＝2 求最大候选面积",
      "t": 2,
      "derive": [
        ["∵", "最大值候选是 t＝2"],
        ["∴", "OO′＝OF′＝2，S△OO′F′＝1/2×2×2＝2"],
        ["∵", "O′M＝2－1/2＝3/2，△MNO′ 是等腰直角三角形"],
        ["∴", "S△MNO′＝(3/2)²÷4＝9/16"],
        ["∵", "F′（0，2），C（0，3/2）"],
        ["∴", "F′C＝1/2，△F′CQ 是等腰直角三角形"],
        ["∴", "S△F′CQ＝(1/2)²÷4＝1/16"],
        ["∵", "S＝S△OO′F′－S△MNO′－S△F′CQ"],
        ["∴", "S(2)＝2－9/16－1/16＝11/8"]
      ],
      "box": ["S(2)＝11/8"]
    },
    {
      "id": "q2b4",
      "section": "第（2）②问",
      "title": "第4步：代入 t＝9/4 求右端面积",
      "t": 2.25,
      "derive": [
        ["∵", "最小值候选之一是 t＝9/4"],
        ["∵", "△O′E′F′ 是等腰直角三角形，O′E′＝E′F′＝2"],
        ["∴", "S△O′E′F′＝2"],
        ["∵", "O′M＝9/4－1/2＝7/4，△MNO′ 是等腰直角三角形"],
        ["∴", "S△MNO′＝(7/4)²÷4＝49/64"],
        ["∵", "过 C 作 CK⊥E′F′ 于 K"],
        ["∴", "CK＝OE′＝1/4，K 在 E′F′ 上"],
        ["∵", "R 在 BC 上，BC 与水平方向成 45°"],
        ["∴", "△RCK 是等腰直角三角形，RK＝CK＝1/4"],
        ["∴", "R（1/4，7/4），E′R＝7/4"],
        ["∴", "F′R＝E′F′－E′R＝2－7/4＝1/4"],
        ["∵", "△F′RQ 是等腰直角三角形"],
        ["∴", "S△F′RQ＝(1/4)²÷4＝1/64"],
        ["∵", "S＝S△O′E′F′－S△MNO′－S△F′RQ"],
        ["∴", "S(9/4)＝2－49/64－1/64＝39/32"]
      ],
      "box": ["S(9/4)＝39/32"]
    },
    {
      "id": "q2b5",
      "section": "第（2）②问",
      "title": "第5步：合并端点值求 S 范围",
      "t": 2,
      "derive": [
        ["∵", "S(5/4)＝41/64，S(9/4)＝39/32"],
        ["∴", "最小值为 41/64"],
        ["∵", "S(2)＝11/8"],
        ["∴", "最大值为 11/8"],
        ["∴", "41/64≤S≤11/8"]
      ],
      "box": ["41/64≤S≤11/8"],
      "minis": [
        { "title": "最小端点", "caption": "t＝5/4 时，S＝41/64。", "t": 1.25 },
        { "title": "最大端点", "caption": "t＝2 时，S＝11/8。", "t": 2 },
        { "title": "右端点", "caption": "t＝9/4 时，S＝39/32。", "t": 2.25 }
      ]
    }
  ],
  "policies": {
    "q1s1": { "movable": false, "range": [0, 0] },
    "q1s2": { "movable": false, "range": [0, 0] },
    "q1s3": { "movable": false, "range": [0, 0] },
    "q2a1": { "movable": true, "range": [0.501, 1.5], "step": 0.001 },
    "q2a2": { "movable": true, "range": [0.501, 1.5], "step": 0.001 },
    "q2a3": { "movable": true, "range": [0.501, 1.5], "step": 0.001 },
    "q2a4": { "movable": true, "range": [0.501, 1.5], "step": 0.001 },
    "q2a5": { "movable": true, "range": [0.5, 1.5], "step": 0.001 },
    "q2b1": { "movable": true, "range": [1.25, 2.25], "step": 0.001 },
    "q2b2": { "movable": true, "range": [1.25, 1.5], "step": 0.001 },
    "q2b3": { "movable": false, "range": [2, 2], "step": 0.001 },
    "q2b4": { "movable": true, "range": [2.001, 2.25], "step": 0.001 },
    "q2b5": { "movable": true, "range": [1.25, 2.25], "step": 0.001 }
  },
  "stepLabels": {
    "q1s1": "1 求F",
    "q1s2": "2 作CH求H",
    "q1s3": "3 求B坐标",
    "q2a1": "1 求OM",
    "q2a2": "2 求O′M",
    "q2a3": "3 判△MO′N",
    "q2a4": "4 求O′N",
    "q2a5": "5 求t范围",
    "q2b1": "1 判S分段",
    "q2b2": "2 算S(5/4)",
    "q2b3": "3 算S(2)",
    "q2b4": "4 算S(9/4)",
    "q2b5": "5 合并S范围"
  }
}
