{
  "meta": {
    "id": "tj-2026-nankai-ermo-24",
    "outputPath": "site/problems/tj/24/tj-2026-nankai-ermo-24.html",
    "pageTitle": "2026 年天津市南开区二模 第 24 题（四边形折叠与重叠面积）",
    "pageDescription": "2026 天津市南开区二模第 24 题：四边形 OABC 沿竖直折痕折叠，求 BD、五边形范围和重叠面积 S 的 t 范围。",
    "breadcrumbTitle": "2026 天津市南开区二模 第 24 题"
  },
  "problem": {
    "summary": "第 24 题（2026 天津市南开区二模）四边形折叠与重叠面积",
    "lines": [
      { "text": "（24）（本题共 10 分）将四边形纸片 OABC 放置在平面直角坐标系中，点 O（0，0），点 A（12，0），点 B，C 在第一象限，且 OC＝4，∠AOC＝60°，CB∥OA，∠OAB＝30°。" },
      { "text": "（I）填空：如图 1，点 C 的坐标为 __________，点 B 的坐标为 __________；", "answerId": "answerI", "answer": "答案：C（2，2√3），B（6，2√3）" },
      { "text": "（II）若 P 为 x 轴的正半轴上一动点，过点 P 作直线 l⊥x 轴，沿直线 l 折叠该纸片，折叠后点 O 的对应点 O′ 落在 x 轴的正半轴上，点 C 的对应点为 C′。设 OP＝t。" },
      { "text": "① 如图 2，若直线 l 与边 BC 相交于点 Q，当折叠后四边形 PQC′O′ 与四边形 OABC 重叠部分为五边形时，C′O′ 与 AB 相交于点 D。试用含有 t 的式子表示线段 BD 的长，并直接写出 t 的取值范围；", "answerId": "answerII1", "answer": "答案：BD＝2√3(t－4)，4＜t＜6" },
      { "text": "② 若设折叠后图形与四边形 OABC 重叠部分的面积为 S，当 8√3/3≤S≤27√3/4 时，求 t 的取值范围（直接写出结果即可）。", "answerId": "answerII2", "answer": "答案：7/3≤t≤9/2 或 11/2≤t≤8" },
      { "heading": "原题图形" },
      { "ariaLabel": "原题图 1 和图 2", "figures": [
        { "id": "originalFigure1", "title": "图 1", "ariaLabel": "图 1：四边形 OABC 放在坐标系中" },
        { "id": "originalFigure2", "title": "图 2", "ariaLabel": "图 2：折叠后四边形 PQC′O′ 与原四边形重叠为五边形" }
      ] }
    ]
  },
  "ui": {
    "legend": [
      { "colorVar": "paper", "label": "原四边形 OABC" },
      { "colorVar": "fold", "label": "折叠后图形 PQC′O′" },
      { "colorVar": "overlap", "label": "当前重叠区域 S" }
    ],
    "sliderLabel": "折痕位置 · t＝OP",
    "paramLabelPrefix": "t=",
    "goToProblemMode": "doubleScroll",
    "groupTitles": {
      "第（I）问": "第（I）问 坐标",
      "第（II）①问": "第（II）① BD 与五边形范围",
      "第（II）②问": "第（II）② 面积范围"
    }
  },
  "steps": [
    {
      "id": "i1s1",
      "section": "第（I）问",
      "title": "第1步：由 30°-60° 关系求 C、B 坐标",
      "t": 5,
      "derive": [
        ["∵", "OC＝4，∠AOC＝60°"],
        ["∴", "C 的横坐标为 4cos60°＝2，纵坐标为 4sin60°＝2√3"],
        ["∴", "C（2，2√3）"],
        ["∵", "CB∥OA，且 ∠OAB＝30°"],
        ["作", "BH⊥AO，垂足为 H"],
        ["∴", "BH＝2√3，∠BHA＝90°"],
        ["∴", "AH＝BH÷tan30°＝6，OH＝12－6＝6"],
        ["∴", "B（6，2√3）"]
      ],
      "box": ["C（2，2√3）", "B（6，2√3）"]
    },
    {
      "id": "q2a1",
      "section": "第（II）①问",
      "title": "第1步：由折叠对称求 O′、C′ 坐标",
      "t": 5,
      "derive": [
        ["∵", "折痕 l 是直线 x＝t"],
        ["∴", "折叠后横坐标关于 x＝t 对称，纵坐标不变"],
        ["∵", "O（0，0），C（2，2√3）"],
        ["∴", "O′（2t，0），C′（2t－2，2√3）"]
      ],
      "box": ["O′（2t，0）", "C′（2t－2，2√3）"]
    },
    {
      "id": "q2a2",
      "section": "第（II）①问",
      "title": "第2步：由等腰三角形求 BD",
      "t": 5,
      "derive": [
        ["∵", "B（6，2√3），C′（2t－2，2√3）"],
        ["∴", "BC′＝2t－8＝2(t－4)"],
        ["∵", "C′O′ 是 OC 折叠后的对应边，且 OC 与 x 轴成 60°"],
        ["∴", "∠BC′D＝120°"],
        ["∵", "AB 与 x 轴夹角为 30°，C′O′ 与 x 轴夹角为 60°"],
        ["∴", "∠C′BD＝∠C′DB＝30°"],
        ["∴", "△BC′D 是顶角 120° 的等腰三角形，BD＝2√3(t－4)"]
      ],
      "box": ["BC′＝C′D＝2(t－4)", "BD＝2√3(t－4)"]
    },
    {
      "id": "q2a3",
      "section": "第（II）①问",
      "title": "第3步：由边界位置判断五边形范围",
      "t": 5,
      "derive": [
        ["∵", "C′ 在 B 的右侧时，2t－2＞6"],
        ["∴", "t＞4"],
        ["∵", "O′ 在 A 的左侧时，2t＜12"],
        ["∴", "t＜6"],
        ["∵", "t＝4 时 D 与 B 重合，t＝6 时 D 与 A 重合"],
        ["∴", "重叠部分为五边形时，4＜t＜6"]
      ],
      "box": ["BD＝2√3(t－4)", "4＜t＜6"],
      "minis": [
        { "title": "t＝4", "caption": "D 与 B 重合，五边形还未形成。", "t": 4 },
        { "title": "4＜t＜6", "caption": "C′O′ 截 AB 于 D，重叠部分为五边形。", "t": 5 },
        { "title": "t＝6", "caption": "D 与 A 重合，五边形退化。", "t": 6 }
      ]
    },
    {
      "id": "q2b1",
      "section": "第（II）②问",
      "title": "第1步：由图形变化判断面积分段",
      "t": 5,
      "derive": [
        ["∵", "0＜t≤2 时，重叠部分是三角形；t＝2 时 S＝2√3＜8√3/3"],
        ["∵", "2＜t≤4 时，重叠部分是梯形 PQC′O′，面积逐渐变大"],
        ["∵", "4＜t＜6 时，重叠部分是五边形 P-Q-B-D-O′，面积先变大再变小"],
        ["∵", "6≤t＜12 时，重叠部分是直角三角形 APR，面积逐渐变小"],
        ["∴", "按四段讨论，边界点 2、4、6 不随意并入形状改变的一侧"]
      ],
      "box": ["0＜t≤2：三角形，不满足", "2＜t≤4：梯形", "4＜t＜6：五边形", "6≤t＜12：三角形"],
      "minis": [
        { "title": "0＜t≤2", "caption": "重叠部分是三角形，t＝2 时仍小于下界。", "t": 2 },
        { "title": "2＜t≤4", "caption": "重叠部分是梯形，面积逐渐变大。", "t": 3 },
        { "title": "4＜t＜6", "caption": "重叠部分是五边形，面积先变大再变小。", "t": 5 },
        { "title": "6≤t＜12", "caption": "重叠部分是三角形，面积逐渐变小。", "t": 7 }
      ]
    },
    {
      "id": "q2b2",
      "section": "第（II）②问",
      "title": "第2步：由梯形面积求 2＜t≤4 的范围",
      "t": 3,
      "derive": [
        ["∵", "上底 QC′＝t－2，下底 PO′＝t，高 PQ＝2√3"],
        ["∴", "S＝[(t－2)+t]×2√3÷2＝√3(2t－2)"],
        ["∵", "8√3/3≤S≤27√3/4"],
        ["∴", "7/3≤t≤35/8"],
        ["∵", "2＜t≤4"],
        ["∴", "本段得到 7/3≤t≤4"]
      ],
      "box": ["S＝√3(2t－2)", "7/3≤t≤4"]
    },
    {
      "id": "q2b3",
      "section": "第（II）②问",
      "title": "第3步：由五边形分解求 4＜t＜6 的范围",
      "t": 5,
      "derive": [
        ["∵", "梯形 PQC′O′ 的面积为 √3(2t－2)"],
        ["∵", "△BC′D 是顶角 120° 的等腰三角形，且 BD＝2√3(t－4)"],
        ["∴", "C′ 到 BD 的高为 t－4"],
        ["∴", "被 AB 截去的 △C′BD 面积为 1/2×2√3(t－4)×(t－4)＝√3(t－4)²"],
        ["∴", "S＝√3[7－(t－5)²]"],
        ["∵", "8/3≤7－(t－5)²≤27/4"],
        ["∴", "(t－5)²≥1/4"],
        ["∵", "4＜t＜6"],
        ["∴", "4＜t≤9/2 或 11/2≤t＜6"]
      ],
      "box": ["S＝√3[7－(t－5)²]", "4＜t≤9/2 或 11/2≤t＜6"]
    },
    {
      "id": "q2b4",
      "section": "第（II）②问",
      "title": "第4步：由直角三角形面积求 6≤t＜12 的范围",
      "t": 7,
      "derive": [
        ["设", "折痕与 AB 交于 R"],
        ["∵", "AP＝12－t，PR＝(12－t)/√3"],
        ["∴", "S＝AP×PR÷2＝√3(12－t)²/6"],
        ["∵", "8√3/3≤S≤27√3/4"],
        ["∴", "16≤(12－t)²≤81/2"],
        ["∵", "6≤t＜12"],
        ["∴", "本段满足条件的是 6≤t≤8"]
      ],
      "box": ["S＝√3(12－t)²/6", "满足条件：6≤t≤8"]
    },
    {
      "id": "q2b5",
      "section": "第（II）②问",
      "title": "第5步：合并最终答案",
      "t": 5,
      "derive": [
        ["∵", "0＜t≤2 中没有满足条件的 t"],
        ["∵", "2＜t≤4 中得到 7/3≤t≤4"],
        ["∵", "4＜t＜6 中得到 4＜t≤9/2 或 11/2≤t＜6"],
        ["∵", "6≤t＜12 中得到 6≤t≤8"],
        ["∴", "合并得 7/3≤t≤9/2 或 11/2≤t≤8"]
      ],
      "box": ["7/3≤t≤9/2 或 11/2≤t≤8"],
      "minis": [
        { "title": "7/3≤t≤9/2", "caption": "左侧从梯形进入五边形，面积在要求范围内。", "t": 3.5 },
        { "title": "11/2≤t≤8", "caption": "五边形后段与三角形阶段都满足面积条件。", "t": 7 }
      ]
    }
  ],
  "policies": {
    "i1s1": { "movable": false, "range": [5, 5] },
    "q2a1": { "movable": true, "range": [4.001, 5.999], "step": 0.001 },
    "q2a2": { "movable": true, "range": [4.001, 5.999], "step": 0.001 },
    "q2a3": { "movable": true, "range": [4, 6], "step": 0.001 },
    "q2b1": { "movable": true, "range": [0.001, 11.999], "step": 0.001 },
    "q2b2": { "movable": true, "range": [2.3333333333, 4], "step": 0.001 },
    "q2b3": { "movable": true, "range": [4.001, 5.999], "step": 0.001 },
    "q2b4": { "movable": true, "range": [6, 11.999], "step": 0.001 },
    "q2b5": { "movable": true, "range": [2.3333333333, 8], "step": 0.001 }
  },
  "stepLabels": {
    "i1s1": "1 求C、B坐标",
    "q2a1": "1 求O′、C′",
    "q2a2": "2 求BD",
    "q2a3": "3 判五边形范围",
    "q2b1": "1 判断分段",
    "q2b2": "2 梯形段范围",
    "q2b3": "3 五边形段范围",
    "q2b4": "4 三角形段范围",
    "q2b5": "5 合并答案"
  }
}
