{
  "meta": {
    "id": "tj-2026-nankai-yimo-24",
    "outputPath": "site/problems/tj/24/tj-2026-nankai-yimo-24.compiled.html",
    "pageTitle": "2026 年天津市南开区一模 第 24 题（旋转三角形与重叠面积）",
    "pageDescription": "2026 天津市南开区一模第 24 题：等边三角形、旋转构造 △MPN、五边形重叠状态、CG 与面积 S 的动态变化。",
    "breadcrumbTitle": "2026 天津市南开区一模 第 24 题"
  },
  "problem": {
    "summary": "第 24 题（2026 天津市南开区一模）旋转三角形：求 C、CD，求 CG 与 t 范围，求 S 范围",
    "lines": [
      { "text": "（24）（本题共 10 分）在平面直角坐标系中，O 为原点，等边 △ABC 的顶点 A（0，3√3），B（0，-√3），点 C 在第一象限，BC 边与 x 轴相交于点 D。点 P 为 x 正半轴上一动点，将线段 OP 绕点 P 顺时针旋转 60° 和 120°，分别得到线段 MP 和线段 NP，连接 MN，得到 △MPN。" },
      { "text": "（I）填空：如图 1，点 C 的坐标为__________，线段 CD 的长为__________；", "answerId": "answerI", "answer": "答案：C＝（6，√3），CD＝2√3" },
      { "text": "（II）设 OP＝t，△MPN 与 △ABC 重合部分面积为 S。" },
      { "text": "① 如图 2，若边 AC 与边 MN 和 PN 分别相交于点 E 和点 F，边 BC 与边 PM 和 PN 分别相交于点 H 和点 G。当 △MPN 与 △ABC 重叠部分为五边形时，试用含有 t 的式子表示线段 CG 的长，并直接写出 t 的取值范围；", "answerId": "answerQ1", "answer": "答案：CG＝（5－t）√3，3＜t＜9/2" },
      { "text": "② 当 1＜t＜5 时，求 S 的取值范围（直接写出结果即可）。", "answerId": "answerQ2", "answer": "答案：√3/4＜S≤45√3/16" },
      { "heading": "原题图形" },
      { "ariaLabel": "原题图 1 和图 2", "figures": [
          { "id": "originalFigure1", "title": "图 1", "ariaLabel": "图 1：等边三角形 ABC 和旋转得到的三角形 MPN" },
          { "id": "originalFigure2", "title": "图 2", "ariaLabel": "图 2：五边形重叠状态中的交点 E、F、H、G" }
        ]
      }
    ]
  },
  "ui": {
    "legend": [
      { "colorVar": "paper",   "label": "固定等边 △ABC" },
      { "colorVar": "fold",    "label": "旋转得到 △MPN" },
      { "colorVar": "overlap", "label": "当前重叠区域 S" }
    ],
    "sliderLabel": "P 点 · t＝OP",
    "paramLabelPrefix": "t=",
    "goToProblemMode": "doubleScroll",
    "groupTitles": {
      "第（I）问": "第（I）问 坐标和长度",
      "第（II）①问": "第（II）① CG 长度",
      "第（II）②问": "第（II）② S 范围"
    }
  },
  "steps": [
    {
      "id": "i1s1",
      "section": "第（I）问",
      "title": "第1步：利用等边三角形性质求 C 点坐标",
      "t": 2,
      "derive": [
        ["∵", "A（0，3√3），B（0，-√3）"],
        ["∴", "AB＝4√3，设 AB 的中点为 I，则 I＝（0，√3）"],
        ["∵", "△ABC 是等边三角形，点 C 在第一象限"],
        ["∴", "CI⊥AB，CI＝4√3×√3/2＝6"],
        ["∴", "C＝（6，√3）"]
      ],
      "box": ["AB＝4√3", "I＝（0，√3）", "CI＝6", "C＝（6，√3）"]
    },
    {
      "id": "i1s2",
      "section": "第（I）问",
      "title": "第2步：由 Rt△OBD 与线段差求 CD",
      "t": 2,
      "derive": [
        ["∵", "△ABC 是等边三角形"],
        ["∴", "BC＝AB＝4√3"],
        ["∵", "OB＝√3，OD⊥OB"],
        ["∵", "∠ABC＝60°"],
        ["∵", "在 Rt△OBD 中，cos60°＝OB/BD"],
        ["∴", "BD＝2√3"],
        ["∴", "CD＝BC－BD＝2√3"]
      ],
      "box": ["BC＝4√3", "OB＝√3", "BD＝2√3", "CD＝BC－BD＝2√3"]
    },
    {
      "id": "q1s1",
      "section": "第（II）①问",
      "title": "第1步：由 Rt△DHP 与旋转角求 DG",
      "t": 3.75,
      "derive": [
        ["∵", "OP＝t，OD＝3"],
        ["∴", "DP＝t－3"],
        ["∵", "PM 由 OP 顺时针旋转 60° 得到"],
        ["∴", "∠HPD＝60°"],
        ["∵", "∠HDP＝∠ODB=30°"],
        ["∴", "∠DHP=90° DH＝√3(t－3)/2"],
        ["∵", "OP 绕 P 顺时针旋转 120° 得到 NP"],
        ["∴", "∠HPG＝∠DPH＝60°"],
        ["∵", "PH⊥DG"],
        ["∴", "△DGP 为等腰三角形"],
        ["∴", "DG＝2DH＝√3(t－3)"]
      ],
      "box": ["DP＝t－3", "DH＝√3(t－3)/2", "DG＝√3(t－3)"]
    },
    {
      "id": "q1s2",
      "section": "第（II）①问",
      "title": "第2步：由线段差求 CG",
      "t": 3.75,
      "derive": [
        ["∵", "第（I）问得 CD＝2√3"],
        ["∵", "DG＝√3(t－3)"],
        ["∴", "CG＝CD－DG＝（5－t）√3"]
      ],
      "box": ["CD＝2√3", "DG＝√3(t－3)", "CG＝CD－DG＝（5－t）√3"]
    },
    {
      "id": "q1s3",
      "section": "第（II）①问",
      "title": "第3步：由边界位置判断五边形的 t 范围",
      "t": 3.75,
      "derive": [
        ["∵", "t＝3 时，P 与 D 重合，重叠部分为三角形"],
        ["∵", "3＜t＜9/2时，重叠部分为五边形"],
        ["∵", "t＝9/2时，M 在 AC 上，重叠部分为四边形"],
        ["∴", "重叠部分为五边形时，3＜t＜9/2"]
      ],
      "box": ["五边形状态：3＜t＜9/2"],
      "minis": [
        { "title": "t＝3", "caption": "P 与 D 重合，重叠部分为三角形。", "t": 3 },
        { "title": "3＜t＜9/2", "caption": "红色重叠区域是五边形。", "t": 3.75 },
        { "title": "t＝9/2", "caption": "M 落在 AC 上，重叠部分为四边形。", "t": 4.5 }
      ]
    },
    {
      "id": "q1s4",
      "section": "第（II）①问",
      "title": "第4步：合并答案",
      "t": 3.75,
      "derive": [["∴", "CG＝（5－t）√3，3＜t＜9/2"]],
      "box": ["CG＝（5－t）√3", "3＜t＜9/2"]
    },
    {
      "id": "q2s1",
      "section": "第（II）②问",
      "title": "第1步：由图形变化判断面积分段",
      "t": 3.75,
      "derive": [
        ["∵", "1＜t≤3 时，△MPN 完全在 △ABC 内"],
        ["∴", "此时重叠部分是整个 △MPN，随着 t 变大，面积变大"],
        ["∵", "3＜t＜9/2 时，重叠部分为五边形"],
        ["∴", "此时重叠部分为五边形，面积先变大再变小"],
        ["∵", "9/2≤t＜5 时，M 离开 △ABC，重叠部分为四边形并继续缩小"],
        ["∴", "此时随着 t 变大，面积变小"],
        ["∴", "先按这三种形状分段，再分别求面积范围"]
      ],
      "box": ["1＜t≤3：三角形，面积变大", "3＜t＜9/2：五边形，面积先变大再变小", "9/2≤t＜5：四边形，面积变小"],
      "minis": [
        { "title": "1＜t≤3", "caption": "△MPN 完全在 △ABC 内，面积变大。", "t": 2.2 },
        { "title": "3＜t＜9/2", "caption": "重叠部分是五边形，面积先变大再变小。", "t": 3.75 },
        { "title": "9/2≤t＜5", "caption": "重叠部分为四边形并继续缩小。", "t": 4.75 }
      ]
    },
    {
      "id": "q2s2",
      "section": "第（II）②问",
      "title": "第2步：在 1＜t≤3 中由三角形面积求范围",
      "t": 2.2,
      "derive": [
        ["∵", "1＜t≤3 时，△MPN 完全在 △ABC 内"],
        ["∵", "△MPN 是等边三角形，边长为 OP＝t"],
        ["∴", "S＝S△MPN＝√3t²/4"],
        ["∵", "1＜t≤3"],
        ["∴", "√3/4＜S≤9√3/4"]
      ],
      "box": ["S＝S△MPN＝√3t²/4", "1＜t≤3", "√3/4＜S≤9√3/4"]
    },
    {
      "id": "q2s3",
      "section": "第（II）②问",
      "title": "第3步：在 3＜t＜9/2 中由五边形面积求范围",
      "t": 3.75,
      "derive": [
        ["∵", "3＜t＜9/2 时，S＝S△MPN－S△PHG－S△NEF"],
        ["∵", "S△MPN＝√3t²/4"],
        ["∵", "上一问已得 DP＝t－3，且 PH⊥DG"],
        ["∴", "PH＝(t－3)/2，HG＝√3(t－3)/2"],
        ["∴", "S△PHG＝√3(t－3)²/8"],
        ["∵", "延长 MN 交 AB 于 K，M＝（t/2，√3t/2）"],
        ["∴", "AK＝3√3－√3t/2，KM＝t/2"],
        ["∵", "Rt△AKE 中，∠A＝60°"],
        ["∴", "KE＝AK·√3＝9－3t/2"],
        ["∴", "ME＝KE－KM＝9－2t，EN＝MN－ME＝t－（9－2t）＝3(t－3)"],
        ["∵", "△NEF 是直角三角形，∠NEF＝30°"],
        ["∴", "NF＝3(t－3)/2，EF＝3√3(t－3)/2"],
        ["∴", "S△NEF＝9√3(t－3)²/8"],
        ["∴", "S＝√3[t²/4－5(t－3)²/4]"],
        ["∴", "S＝-√3(t－15/4)²＋45√3/16"],
        ["∴", "9√3/4＜S≤45√3/16"]
      ],
      "box": ["S△PHG＝√3(t－3)²/8", "S△NEF＝9√3(t－3)²/8", "S＝-√3(t－15/4)²＋45√3/16", "Smax＝45√3/16"]
    },
    {
      "id": "q2s4",
      "section": "第（II）②问",
      "title": "第4步：在 9/2≤t＜5 中由四边形面积求范围",
      "t": 4.75,
      "derive": [
        ["∵", "9/2≤t＜5 时，重叠部分为四边形并随 t 变大而缩小"],
        ["设", "PM 与 AC 交于 R"],
        ["∵", "重叠四边形 RFGH＝△RHC－△CGF"],
        ["∵", "HG＝√3(t－3)/2，CG＝（5－t）√3"],
        ["∴", "CH＝HG＋CG＝√3(7－t)/2"],
        ["∵", "△RHC 是直角三角形，∠RCH＝60°"],
        ["∴", "RH＝3(7－t)/2，S△RHC＝3√3(7－t)²/8"],
        ["∵", "△CGF 是直角三角形，∠CGF＝30°，CG＝（5－t）√3"],
        ["∴", "S△CGF＝3√3(5－t)²/8"],
        ["∴", "S＝S△RHC－S△CGF＝-3√3t/2＋9√3"],
        ["∴", "3√3/2＜S≤9√3/4"]
      ],
      "box": ["CH＝√3(7－t)/2", "S＝-3√3t/2＋9√3", "3√3/2＜S≤9√3/4"]
    },
    {
      "id": "q2s5",
      "section": "第（II）②问",
      "title": "第5步：合并最终答案",
      "t": 3.75,
      "derive": [
        ["∵", "由三角形面积得到 √3/4＜S≤9√3/4"],
        ["∵", "由五边形面积得到 9√3/4＜S≤45√3/16"],
        ["∵", "由四边形面积得到 3√3/2＜S≤9√3/4"],
        ["∴", "√3/4＜S≤45√3/16"]
      ],
      "box": ["√3/4＜S≤45√3/16"]
    }
  ],
  "policies": {
    "i1s1": { "movable": false, "range": [2, 2] },
    "i1s2": { "movable": false, "range": [2, 2] },
    "q1s1": { "movable": true,  "range": [3.001, 4.499] },
    "q1s2": { "movable": true,  "range": [3.001, 4.499] },
    "q1s3": { "movable": true,  "range": [2.85, 4.65] },
    "q1s4": { "movable": true,  "range": [3.001, 4.499] },
    "q2s1": { "movable": true,  "range": [1.001, 4.999] },
    "q2s2": { "movable": true,  "range": [1.001, 3] },
    "q2s3": { "movable": true,  "range": [3.001, 4.499] },
    "q2s4": { "movable": true,  "range": [4.5, 4.999] },
    "q2s5": { "movable": true,  "range": [1.001, 4.999] }
  },
  "stepLabels": {
    "i1s1": "1 求C坐标",
    "i1s2": "2 求CD",
    "q1s1": "1 求DG",
    "q1s2": "2 求CG",
    "q1s3": "3 判断边界",
    "q1s4": "4 合并答案",
    "q2s1": "1 判断分段",
    "q2s2": "2 三角形面积",
    "q2s3": "3 五边形面积",
    "q2s4": "4 四边形面积",
    "q2s5": "5 合并答案"
  }
}

