{
  "meta": {
    "id": "tj-2026-binhai-yimo-24",
    "outputPath": "site/problems/tj/24/tj-2026-binhai-yimo-24.html",
    "pageTitle": "2026 年天津市滨海新区一模 第 24 题（平移菱形与重叠面积）",
    "pageDescription": "2026 天津市滨海新区一模第 24 题：矩形 OABC、菱形 EFGH 水平平移、五边形重叠面积 S 与范围。",
    "breadcrumbTitle": "2026 天津市滨海新区一模 第 24 题"
  },
  "problem": {
    "summary": "第 24 题（2026 天津市滨海新区一模）平移菱形与矩形重叠面积",
    "lines": [
      { "text": "（24）在平面直角坐标系中，O 为原点，矩形 OABC 的顶点 A（8，0），C（0，6），菱形 EFGH 的顶点 E（0，3），F（-3，3-√3），G（-6，3），连接 EG。" },
      { "text": "（1）填空：如图①，点 B 的坐标为__________，点 H 的坐标为__________；", "answerId": "answer1", "answer": "答案：B（8，6），H（-3，3+√3）" },
      { "text": "（2）将菱形 EFGH 沿水平方向向右平移，得到菱形 E′F′G′H′，点 E，F，G，H 的对应点分别为 E′，F′，G′，H′. 设 EE′＝t，菱形 E′F′G′H′ 与矩形 OABC 重叠部分的面积为 S。" },
      { "text": "①如图②，当边 G′F′，G′H′ 分别与 OC 相交于点 M，点 N，且菱形 E′F′G′H′ 与矩形 OABC 重叠部分为五边形时，试用含有 t 的式子表示 S，并直接写出 t 的取值范围；", "answerId": "answer2a", "answer": "答案：S＝6√3-√3(6-t)²/3，3＜t＜6" },
      { "text": "②当 4≤t≤9 时，求 S 的取值范围（直接写出结果即可）。", "answerId": "answer2b", "answer": "答案：14√3/3≤S≤6√3" },
      { "heading": "原题图形" },
      { "ariaLabel": "原题图 1 和图 2", "figures": [
        { "id": "originalFigure1", "title": "图 1", "ariaLabel": "图 1：矩形 OABC 与原菱形 EFGH" },
        { "id": "originalFigure2", "title": "图 2", "ariaLabel": "图 2：平移后五边形重叠状态，G′F′、G′H′ 与 OC 交于 M、N" }
      ] }
    ]
  },
  "ui": {
    "legend": [
      { "colorVar": "paper", "label": "固定矩形 OABC" },
      { "colorVar": "fold", "label": "平移菱形 E′F′G′H′" },
      { "colorVar": "overlap", "label": "当前重叠区域 S" }
    ],
    "sliderLabel": "平移距离 · t＝EE′",
    "paramLabelPrefix": "t=",
    "goToProblemMode": "doubleScroll",
    "groupTitles": {
      "第（1）问": "第（1）问 坐标",
      "第（2）①问": "第（2）① 五边形面积",
      "第（2）②问": "第（2）② S 范围"
    }
  },
  "steps": [
    {
      "id": "q1s1",
      "section": "第（1）问",
      "title": "第1步：由矩形性质求 B、H 坐标",
      "t": 0,
      "derive": [
        ["∵", "O（0，0），A（8，0），C（0，6），OABC 是矩形"],
        ["∴", "B 的横坐标与 A 相同，纵坐标与 C 相同"],
        ["∴", "B（8，6）"],
        ["∵", "菱形 EFGH 关于 EG 对称，F（-3，3-√3）"],
        ["∴", "H（-3，3+√3）"]
      ],
      "box": ["B（8，6）", "H（-3，3+√3）"]
    },
    {
      "id": "q2a1",
      "section": "第（2）①问",
      "title": "第1步：由边长判断 △G′F′H′ 为等边三角形",
      "t": 4.5,
      "derive": [
        ["∵", "F（-3，3-√3），G（-6，3），H（-3，3+√3）"],
        ["∴", "GF＝GH＝FH＝2√3"],
        ["∴", "△GHF 是等边三角形"],
        ["∵", "平移不改变线段长度和角度"],
        ["∴", "△G′H′F′ 也是等边三角形"]
      ],
      "box": ["△GHF 是等边三角形", "△G′H′F′ 是等边三角形"]
    },
    {
      "id": "q2a2",
      "section": "第（2）①问",
      "title": "第2步：由平行截线判断 △G′MN 为等边三角形",
      "t": 4.5,
      "derive": [
        ["∵", "MN 在 OC 上，F′H′ 是竖直线段"],
        ["∴", "MN∥F′H′"],
        ["∴", "△G′MN∽△G′F′H′"],
        ["∵", "△G′F′H′ 是等边三角形"],
        ["∴", "△G′MN 也是等边三角形"]
      ],
      "box": ["MN∥F′H′", "△G′MN 是等边三角形"]
    },
    {
      "id": "q2a3",
      "section": "第（2）①问",
      "title": "第3步：由等边三角形高求截去面积",
      "t": 4.5,
      "derive": [
        ["∵", "平移后 G′（t-6，3），OC 与 EG 所在直线交于 E（0，3）"],
        ["∴", "G′E＝6-t"],
        ["∵", "△G′MN 是等边三角形，G′E 垂直 MN"],
        ["∴", "G′E 是 △G′MN 的高"],
        ["∵", "等边三角形面积＝高²/√3"],
        ["∴", "S△G′MN＝(6-t)²/√3＝√3(6-t)²/3"]
      ],
      "box": ["G′E＝6-t", "S△G′MN＝√3(6-t)²/3"]
    },
    {
      "id": "q2a4",
      "section": "第（2）①问",
      "title": "第4步：由菱形减三角形求 S 与 t 范围",
      "t": 4.5,
      "derive": [
        ["∵", "E′G′＝6，F′H′＝2√3"],
        ["∴", "S菱形＝6×2√3÷2＝6√3"],
        ["∵", "重叠五边形＝菱形 E′F′G′H′－△G′MN"],
        ["∴", "S＝6√3-√3(6-t)²/3"],
        ["∵", "左边界：t＝3 时，F′、H′ 在 OC 上，重叠部分不是五边形"],
        ["∵", "右边界：t＝6 时，G′ 在 OC 上，菱形刚好完全进入矩形"],
        ["∴", "五边形状态为 3＜t＜6"]
      ],
      "box": ["S＝6√3-√3(6-t)²/3", "3＜t＜6"],
      "minis": [
        { "title": "t＝3", "caption": "F′、H′ 落在 OC 上，五边形还未出现。", "t": 3 },
        { "title": "3＜t＜6", "caption": "左侧被截去三角形，重叠部分为五边形。", "t": 4.5 },
        { "title": "t＝6", "caption": "G′ 落在 OC 上，菱形刚好完全进入矩形。", "t": 6 }
      ]
    },
    {
      "id": "q2b1",
      "section": "第（2）②问",
      "title": "第1步：由边界状态判断面积分段",
      "t": 7,
      "derive": [
        ["∵", "4≤t＜6 时，G′ 在 OC 左侧，重叠部分为左侧五边形"],
        ["∴", "此时 S 随 t 增大而增大"],
        ["∵", "6≤t≤8 时，菱形完全在矩形内"],
        ["∴", "此时 S＝6√3"],
        ["∵", "8＜t≤9 时，E′ 在 AB 右侧，重叠部分为右侧五边形"],
        ["∴", "此时 S 随 t 增大而减小"]
      ],
      "box": ["4≤t＜6：左侧五边形，面积变大", "6≤t≤8：完整菱形，面积为 6√3", "8＜t≤9：右侧五边形，面积变小"],
      "minis": [
        { "title": "4≤t＜6", "caption": "左侧被 OC 截去小三角形，面积变大。", "t": 4.5 },
        { "title": "6≤t≤8", "caption": "菱形完全在矩形内，面积保持 6√3。", "t": 7 },
        { "title": "8＜t≤9", "caption": "右侧被 AB 截去小三角形，面积变小。", "t": 8.5 }
      ]
    },
    {
      "id": "q2b2",
      "section": "第（2）②问",
      "title": "第2步：在 4≤t＜6 中求左侧五边形面积范围",
      "t": 4.5,
      "derive": [
        ["∵", "第（2）①问已得 S＝6√3-√3(6-t)²/3"],
        ["∵", "4≤t＜6"],
        ["∴", "t＝4 时，S＝14√3/3"],
        ["∴", "14√3/3≤S＜6√3"]
      ],
      "box": ["S＝6√3-√3(6-t)²/3", "14√3/3≤S＜6√3"]
    },
    {
      "id": "q2b3",
      "section": "第（2）②问",
      "title": "第3步：在 6≤t≤8 中由完整菱形求面积",
      "t": 7,
      "derive": [
        ["∵", "6≤t≤8 时，菱形 E′F′G′H′ 完全在矩形 OABC 内"],
        ["∴", "S＝S菱形＝6√3"]
      ],
      "box": ["6≤t≤8", "S＝6√3"]
    },
    {
      "id": "q2b4",
      "section": "第（2）②问",
      "title": "第4步：在 8＜t≤9 中求右侧五边形面积范围",
      "t": 8.5,
      "derive": [
        ["设", "E′F′、E′H′ 分别与 AB 交于 U、V"],
        ["∵", "UV 在 AB 上，F′H′ 是竖直线段"],
        ["∴", "UV∥F′H′"],
        ["∴", "△E′UV∽△E′F′H′"],
        ["∵", "△E′F′H′ 是等边三角形"],
        ["∴", "△E′UV 也是等边三角形"],
        ["∵", "E′ 到 AB 的水平距离为 t-8"],
        ["∴", "t-8 是 △E′UV 的高"],
        ["∴", "S△E′UV＝(t-8)²/√3＝√3(t-8)²/3"],
        ["∴", "S＝6√3-√3(t-8)²/3"],
        ["∵", "8＜t≤9"],
        ["∴", "17√3/3≤S＜6√3"]
      ],
      "box": ["△E′UV 是等边三角形", "S＝6√3-√3(t-8)²/3", "17√3/3≤S＜6√3"]
    },
    {
      "id": "q2b5",
      "section": "第（2）②问",
      "title": "第5步：合并最终答案",
      "t": 7,
      "derive": [
        ["∵", "4≤t＜6 时，14√3/3≤S＜6√3"],
        ["∵", "6≤t≤8 时，S＝6√3"],
        ["∵", "8＜t≤9 时，17√3/3≤S＜6√3"],
        ["∴", "14√3/3≤S≤6√3"]
      ],
      "box": ["14√3/3≤S≤6√3"],
      "minis": [
        { "title": "左侧五边形", "caption": "t＝4 时取到本题最小值 14√3/3。", "t": 4 },
        { "title": "完整菱形", "caption": "6≤t≤8 时面积达到最大值 6√3。", "t": 7 },
        { "title": "右侧五边形", "caption": "t＝9 时面积为 17√3/3。", "t": 9 }
      ]
    }
  ],
  "policies": {
    "q1s1": { "movable": false, "range": [0, 0] },
    "q2a1": { "movable": true, "range": [3.001, 5.999], "step": 0.001 },
    "q2a2": { "movable": true, "range": [3.001, 5.999], "step": 0.001 },
    "q2a3": { "movable": true, "range": [3.001, 5.999], "step": 0.001 },
    "q2a4": { "movable": true, "range": [3, 6], "step": 0.001 },
    "q2b1": { "movable": true, "range": [4, 9], "step": 0.001 },
    "q2b2": { "movable": true, "range": [4, 5.999], "step": 0.001 },
    "q2b3": { "movable": true, "range": [6, 8], "step": 0.001 },
    "q2b4": { "movable": true, "range": [8.001, 9], "step": 0.001 },
    "q2b5": { "movable": true, "range": [4, 9], "step": 0.001 }
  },
  "stepLabels": {
    "q1s1": "1 求B、H",
    "q2a1": "1 判等边△G′F′H′",
    "q2a2": "2 判等边△G′MN",
    "q2a3": "3 求△G′MN面积",
    "q2a4": "4 求S与范围",
    "q2b1": "1 判断分段",
    "q2b2": "2 左侧五边形面积范围",
    "q2b3": "3 完整菱形面积范围",
    "q2b4": "4 右侧五边形面积范围",
    "q2b5": "5 合并答案"
  }
}
